{
  "schema_version": "0.3.0",
  "artifact_type": "test_scenarios",
  "artifact_id": "test_scenarios-run_demo_001-000-aaaa0001",
  "run_id": "run_demo_001",
  "iteration": 0,
  "producer": "scenario_generator",
  "mode": "development",
  "created_at": "2026-10-07T00:00:00.000000Z",
  "status": "completed",
  "input_refs": [],
  "errors": [],
  "runtime_metrics": null,
  "data": {
    "scenarios": [
      {
        "scenario_id": "scenario_allow",
        "candidate_id": "cand_allow",
        "expected_basis": "inferred",
        "resource_ids": [
          "resource:order_7"
        ],
        "preconditions": [],
        "steps": [
          {
            "step_id": "step_allow_1",
            "order": 0,
            "source_request_id": "req_user_order",
            "account_id": "acc_user",
            "role_id": "role_user",
            "session_ref": "sess_user",
            "request": {
              "method": "GET",
              "url_template": "http://127.0.0.1:8001/orders/7",
              "parameters": [],
              "body_ref": null
            },
            "bindings": [],
            "state_change": "none"
          }
        ],
        "assertions": [
          {
            "check_id": "assert_owner_read_status",
            "kind": "response_status",
            "subject_ref": "step_allow_1",
            "selector": null,
            "operator": "eq",
            "expected": 200
          },
          {
            "check_id": "assert_owner_read_body",
            "kind": "response_json",
            "subject_ref": "step_allow_1",
            "selector": "/owner_id",
            "operator": "exists",
            "expected": true
          }
        ]
      },
      {
        "scenario_id": "scenario_block",
        "candidate_id": "cand_block",
        "expected_basis": "unknown",
        "resource_ids": [
          "resource:order_7"
        ],
        "preconditions": [],
        "steps": [
          {
            "step_id": "step_block_1",
            "order": 0,
            "source_request_id": "req_user_update",
            "account_id": "acc_user",
            "role_id": "role_user",
            "session_ref": "sess_user",
            "request": {
              "method": "POST",
              "url_template": "http://127.0.0.1:8001/orders/{binding_id}",
              "parameters": [],
              "body_ref": null
            },
            "bindings": [],
            "state_change": "expected"
          }
        ],
        "assertions": []
      }
    ],
    "model_info": null
  }
}
